company_name,contact_name,channel_used,status,timestamp,email_preview
COBRE CERRILLOS S A COCESA,,unknown,pending,2026-03-28T23:33:33.545897+00:00,"Hi there,

Given COBRE CERRILLOS' operations in Chile's copper industry, I imagine reliable power transmission and industrial cabling are critical to maintaining your mining and processing operations."
WENZHOU KASAN ELECTRIC CO LTD,,unknown,pending,2026-03-28T23:33:39.076512+00:00,"Hi there,

I noticed that WENZHOU KASAN ELECTRIC CO LTD operates in the electrical equipment manufacturing space, which means reliable cable supply is absolutely critical to your operations. I'm reach"
MARLEW SA,,unknown,pending,2026-03-28T23:33:44.574292+00:00,"Hi there,

I noticed MARLEW SA operates in a sector where reliable electrical infrastructure is critical to maintaining operations and minimizing downtime. I'm reaching out because Test Cable speciali"
